{
 "schema_version": "1.0",
 "contract_version": "1.8.0",
 "generated_at": "2026-10-24",
 "params": {
  "season_weeks": 48,
  "cash_reserve_weeks": 8,
  "salary_bands": {
   "1": {
    "star": [
     50000,
     100000
    ],
    "regular": [
     15000,
     50000
    ]
   },
   "2": {
    "all": [
     1000,
     5000
    ]
   },
   "3": {
    "all": [
     1000,
     5000
    ]
   }
  },
  "weights": {
   "money": 0.35,
   "team": 0.25,
   "prestige": 0.15,
   "role": 0.15,
   "reputation": 0.1
  },
  "hype_half_life_weeks": 12,
  "buyout": {
   "interest_step": 0.15,
   "max_seasons": 1.25,
   "hype_divisor": 200
  },
  "generator": {
   "skill_mean": {
    "1": 78,
    "2": 62,
    "3": 48
   },
   "skill_std": 8,
   "hidden_mean": {
    "1": 72,
    "2": 58,
    "3": 46
   },
   "tail_prob": {
    "1": 0.0,
    "2": 0.03,
    "3": 0.05
   },
   "role_weights": {
    "rifler": 30,
    "entry": 15,
    "lurker": 12,
    "support": 12,
    "awper": 12,
    "igl": 8,
    "coach": 11
   }
  },
  "salary_skill_range": {
   "star": [
    85,
    100
   ],
   "regular": [
    60,
    85
   ],
   "low": [
    30,
    80
   ]
  },
  "salary_blend": {
   "skill": 0.7,
   "hype": 0.3
  },
  "tier_sizes": {
   "1": 10,
   "2": 12,
   "3": 16
  },
  "sponsor_week": {
   "1": 70000,
   "2": 6000,
   "3": 4500
  },
  "rank_factor": [
   1.3,
   0.7
  ],
  "sticker_pool": {
   "1": 1500000,
   "2": 0,
   "3": 0
  },
  "hype_match": {
   "per_rating_point": 8,
   "win": 2,
   "loss": -1,
   "major_multiplier": 2.0,
   "form_blend": 0.2,
   "form_scale": 10
  },
  "accept_threshold": 0.4,
  "role_cap": {
   "rifler": 2,
   "entry": 1,
   "lurker": 1,
   "support": 1,
   "awper": 1,
   "igl": 1,
   "coach": 1
  },
  "money_star_discount": 1.4,
  "market": {
   "offer_weeks": 96,
   "bonus_months": 1,
   "style_spend": {
    "aggressive": 0.9,
    "conservative": 0.5
   },
   "style_premium": {
    "aggressive": 1.15,
    "conservative": 1.0
   },
   "poach_margin": {
    "aggressive": 4,
    "conservative": 8
   }
  },
  "scouting": {
   "noise": {
    "0": 12,
    "1": 8,
    "2": 4,
    "3": 1.5
   },
   "cost": {
    "1": {
     "money": 2000,
     "weeks": 1
    },
    "2": {
     "money": 6000,
     "weeks": 2
    },
    "3": {
     "money": 15000,
     "weeks": 3
    }
   },
   "reveals": {
    "1": [
     "consistency"
    ],
    "2": [
     "consistency",
     "communication",
     "ceiling"
    ],
    "3": [
     "consistency",
     "communication",
     "ceiling",
     "lan_form",
     "temperament"
    ]
   }
  },
  "game": {
   "free_agents": {
    "2": 20,
    "3": 40
   },
   "ai_budget": {
    "1": 8000000,
    "2": 400000,
    "3": 200000
   },
   "prestige": {
    "1": [
     70,
     95
    ],
    "2": [
     40,
     65
    ],
    "3": [
     10,
     35
    ]
   },
   "human": {
    "prestige": 5,
    "reputation": 30
   },
   "difficulty": {
    "easy": {
     "human_budget": 250000,
     "aggressive_share": 0.2
    },
    "normal": {
     "human_budget": 150000,
     "aggressive_share": 0.4
    },
    "hard": {
     "human_budget": 90000,
     "aggressive_share": 0.6
    }
   },
   "majors": [
    20,
    44
   ],
   "league_round_every": 12,
   "windows": [
    [
     1,
     4
    ],
    [
     21,
     24
    ],
    [
     45,
     48
    ]
   ],
   "prize_pool": {
    "1": 600000,
    "2": 40000,
    "3": 15000
   },
   "major_prize": 1200000,
   "prize_weights": [
    0.4,
    0.25,
    0.15,
    0.1
   ],
   "match_scale": 8,
   "promote": 2,
   "expiry_warning_weeks": 4,
   "growth_rate": 0.15,
   "growth_max": 3,
   "growth_max_age": 23
  }
 }
}
